Ticker,TR06,TR08,TR10,TR12
"First Trust Dow Jones Select MicroCap Index Fund (FDM)",12.9%,18.1%,24.4%,23.5%
"Vanguard Long-Term Corporate Bond Index Fund (VCLT)",12.3%,18.1%,22.4%,22.7%
"PowerShares Financial Preferred Portfolio (PGF)",17.6%,24.8%,27.4%,0.0%
"PowerShares High Yield Equity Dividend Achievers Portfolio (PEY)",6.1%,8.6%,12.0%,33.5%
"iShares Core 10+ Year USD Bond ETF (ILTB)",5.9%,7.9%,13.7%,20.3%
"Vanguard Short-Term Corporate Bond Index Fund (VCSH)",19.2%,22.6%,0.0%,0.0%
"PIMCO Enhanced Short Maturity Active ETF (MINT)",26.0%,0.0%,0.0%,0.0%
